{
  "schemaVersion": "gold-predictions.v1",
  "algorithmVersion": "policy.v1-before",
  "corpusVersion": "1.0.0",
  "generatedAt": "2026-07-17T00:00:00.000Z",
  "predictions": [
    {
      "exampleId": "gc-001",
      "relevance": "exclude",
      "publish": false,
      "confidence": 0.25,
      "citationEntailed": false,
      "entityResolution": "review_required"
    },
    {
      "exampleId": "gc-002",
      "relevance": "include",
      "publish": true,
      "confidence": 0.78,
      "citationEntailed": true,
      "entityResolution": "match",
      "resolvedEntityId": "entity-gc-002"
    },
    {
      "exampleId": "gc-003",
      "relevance": "include",
      "publish": true,
      "confidence": 0.78,
      "citationEntailed": true,
      "entityResolution": "match",
      "resolvedEntityId": "entity-gc-003"
    },
    {
      "exampleId": "gc-004",
      "relevance": "include",
      "publish": true,
      "confidence": 0.78,
      "citationEntailed": true,
      "entityResolution": "match",
      "resolvedEntityId": "entity-gc-004"
    },
    {
      "exampleId": "gc-005",
      "relevance": "include",
      "publish": true,
      "confidence": 0.78,
      "citationEntailed": true,
      "entityResolution": "match",
      "resolvedEntityId": "entity-gc-005"
    },
    {
      "exampleId": "gc-006",
      "relevance": "include",
      "publish": true,
      "confidence": 0.78,
      "citationEntailed": true,
      "entityResolution": "match",
      "resolvedEntityId": "entity-gc-006"
    },
    {
      "exampleId": "gc-007",
      "relevance": "include",
      "publish": true,
      "confidence": 0.78,
      "citationEntailed": true,
      "entityResolution": "match",
      "resolvedEntityId": "entity-gc-007"
    },
    {
      "exampleId": "gc-008",
      "relevance": "include",
      "publish": true,
      "confidence": 0.78,
      "citationEntailed": true,
      "entityResolution": "match",
      "resolvedEntityId": "entity-gc-008"
    },
    {
      "exampleId": "gc-009",
      "relevance": "include",
      "publish": true,
      "confidence": 0.78,
      "citationEntailed": true,
      "entityResolution": "match",
      "resolvedEntityId": "entity-gc-009"
    },
    {
      "exampleId": "gc-010",
      "relevance": "exclude",
      "publish": false,
      "confidence": 0.25,
      "citationEntailed": false,
      "entityResolution": "review_required"
    },
    {
      "exampleId": "gc-011",
      "relevance": "exclude",
      "publish": false,
      "confidence": 0.22,
      "citationEntailed": false,
      "entityResolution": "no_match"
    },
    {
      "exampleId": "gc-012",
      "relevance": "exclude",
      "publish": false,
      "confidence": 0.22,
      "citationEntailed": false,
      "entityResolution": "no_match"
    },
    {
      "exampleId": "gc-013",
      "relevance": "exclude",
      "publish": false,
      "confidence": 0.22,
      "citationEntailed": false,
      "entityResolution": "no_match"
    },
    {
      "exampleId": "gc-014",
      "relevance": "exclude",
      "publish": false,
      "confidence": 0.22,
      "citationEntailed": false,
      "entityResolution": "no_match"
    },
    {
      "exampleId": "gc-015",
      "relevance": "exclude",
      "publish": false,
      "confidence": 0.22,
      "citationEntailed": false,
      "entityResolution": "no_match"
    },
    {
      "exampleId": "gc-016",
      "relevance": "exclude",
      "publish": false,
      "confidence": 0.22,
      "citationEntailed": false,
      "entityResolution": "no_match"
    },
    {
      "exampleId": "gc-017",
      "relevance": "exclude",
      "publish": false,
      "confidence": 0.22,
      "citationEntailed": false,
      "entityResolution": "no_match"
    },
    {
      "exampleId": "gc-018",
      "relevance": "exclude",
      "publish": false,
      "confidence": 0.22,
      "citationEntailed": false,
      "entityResolution": "no_match"
    },
    {
      "exampleId": "gc-019",
      "relevance": "include",
      "publish": true,
      "confidence": 0.75,
      "citationEntailed": true,
      "entityResolution": "match",
      "resolvedEntityId": "incorrect-gc-019"
    },
    {
      "exampleId": "gc-020",
      "relevance": "exclude",
      "publish": false,
      "confidence": 0.22,
      "citationEntailed": false,
      "entityResolution": "no_match"
    },
    {
      "exampleId": "gc-021",
      "relevance": "include",
      "publish": true,
      "confidence": 0.78,
      "citationEntailed": true,
      "entityResolution": "match",
      "resolvedEntityId": "entity-gc-021"
    },
    {
      "exampleId": "gc-022",
      "relevance": "include",
      "publish": true,
      "confidence": 0.78,
      "citationEntailed": true,
      "entityResolution": "match",
      "resolvedEntityId": "entity-gc-022"
    },
    {
      "exampleId": "gc-023",
      "relevance": "include",
      "publish": true,
      "confidence": 0.78,
      "citationEntailed": true,
      "entityResolution": "match",
      "resolvedEntityId": "entity-gc-023"
    },
    {
      "exampleId": "gc-024",
      "relevance": "include",
      "publish": true,
      "confidence": 0.78,
      "citationEntailed": true,
      "entityResolution": "match",
      "resolvedEntityId": "entity-gc-024"
    },
    {
      "exampleId": "gc-025",
      "relevance": "include",
      "publish": true,
      "confidence": 0.78,
      "citationEntailed": true,
      "entityResolution": "match",
      "resolvedEntityId": "entity-gc-025"
    },
    {
      "exampleId": "gc-026",
      "relevance": "include",
      "publish": true,
      "confidence": 0.78,
      "citationEntailed": true,
      "entityResolution": "match",
      "resolvedEntityId": "entity-gc-026"
    },
    {
      "exampleId": "gc-027",
      "relevance": "include",
      "publish": true,
      "confidence": 0.78,
      "citationEntailed": true,
      "entityResolution": "match",
      "resolvedEntityId": "entity-gc-027"
    },
    {
      "exampleId": "gc-028",
      "relevance": "exclude",
      "publish": false,
      "confidence": 0.25,
      "citationEntailed": false,
      "entityResolution": "review_required"
    },
    {
      "exampleId": "gc-029",
      "relevance": "include",
      "publish": true,
      "confidence": 0.78,
      "citationEntailed": true,
      "entityResolution": "match",
      "resolvedEntityId": "entity-gc-029"
    },
    {
      "exampleId": "gc-030",
      "relevance": "include",
      "publish": true,
      "confidence": 0.78,
      "citationEntailed": true,
      "entityResolution": "match",
      "resolvedEntityId": "entity-gc-030"
    },
    {
      "exampleId": "gc-031",
      "relevance": "exclude",
      "publish": false,
      "confidence": 0.22,
      "citationEntailed": false,
      "entityResolution": "no_match"
    },
    {
      "exampleId": "gc-032",
      "relevance": "exclude",
      "publish": false,
      "confidence": 0.22,
      "citationEntailed": false,
      "entityResolution": "no_match"
    },
    {
      "exampleId": "gc-033",
      "relevance": "exclude",
      "publish": false,
      "confidence": 0.22,
      "citationEntailed": false,
      "entityResolution": "no_match"
    },
    {
      "exampleId": "gc-034",
      "relevance": "exclude",
      "publish": false,
      "confidence": 0.22,
      "citationEntailed": false,
      "entityResolution": "no_match"
    },
    {
      "exampleId": "gc-035",
      "relevance": "exclude",
      "publish": false,
      "confidence": 0.22,
      "citationEntailed": false,
      "entityResolution": "no_match"
    },
    {
      "exampleId": "gc-036",
      "relevance": "exclude",
      "publish": false,
      "confidence": 0.22,
      "citationEntailed": false,
      "entityResolution": "no_match"
    },
    {
      "exampleId": "gc-037",
      "relevance": "include",
      "publish": true,
      "confidence": 0.75,
      "citationEntailed": true,
      "entityResolution": "match",
      "resolvedEntityId": "incorrect-gc-037"
    },
    {
      "exampleId": "gc-038",
      "relevance": "exclude",
      "publish": false,
      "confidence": 0.22,
      "citationEntailed": false,
      "entityResolution": "no_match"
    },
    {
      "exampleId": "gc-039",
      "relevance": "exclude",
      "publish": false,
      "confidence": 0.22,
      "citationEntailed": false,
      "entityResolution": "no_match"
    },
    {
      "exampleId": "gc-040",
      "relevance": "exclude",
      "publish": false,
      "confidence": 0.22,
      "citationEntailed": false,
      "entityResolution": "no_match"
    },
    {
      "exampleId": "gc-041",
      "relevance": "supporting_context",
      "publish": false,
      "confidence": 0.22,
      "citationEntailed": true,
      "entityResolution": "review_required"
    },
    {
      "exampleId": "gc-042",
      "relevance": "supporting_context",
      "publish": false,
      "confidence": 0.22,
      "citationEntailed": false,
      "entityResolution": "review_required"
    },
    {
      "exampleId": "gc-043",
      "relevance": "supporting_context",
      "publish": false,
      "confidence": 0.22,
      "citationEntailed": true,
      "entityResolution": "review_required"
    },
    {
      "exampleId": "gc-044",
      "relevance": "supporting_context",
      "publish": false,
      "confidence": 0.22,
      "citationEntailed": false,
      "entityResolution": "review_required"
    },
    {
      "exampleId": "gc-045",
      "relevance": "supporting_context",
      "publish": false,
      "confidence": 0.22,
      "citationEntailed": true,
      "entityResolution": "review_required"
    },
    {
      "exampleId": "gc-046",
      "relevance": "include",
      "publish": true,
      "confidence": 0.75,
      "citationEntailed": true,
      "entityResolution": "match",
      "resolvedEntityId": "incorrect-gc-046"
    },
    {
      "exampleId": "gc-047",
      "relevance": "supporting_context",
      "publish": false,